{
  "answer_length": null,
  "answer_sha256": null,
  "browser_status": "skipped",
  "browser_summary": null,
  "bundle_markdown_path": null,
  "chunk_ids": [],
  "citation_ids": [],
  "claim_ids": [],
  "content_sha256": null,
  "domain": "llm_agent_memory",
  "evidence_level": null,
  "final_status": "acceptance_failed",
  "knowledge_id": null,
  "knowledge_version": null,
  "manifest_status": null,
  "model": "deepseek-v4-flash",
  "provenance_sha256": null,
  "receipt_schema_version": 1,
  "run_id": "real-paper-cdbde2ca-641f-4bd5-bea7-fe413db2d3ca",
  "run_kind": "real",
  "source_anchor_ids": [],
  "source_id": "2608.04746v1",
  "stages": [
    {
      "duration_ms": 7520,
      "error_code": null,
      "error_summary": null,
      "metrics": {
        "check_count": 5
      },
      "name": "preflight",
      "started_at": "2026-08-22T12:55:39.019250Z",
      "status": "passed"
    },
    {
      "duration_ms": 43,
      "error_code": null,
      "error_summary": null,
      "metrics": {
        "candidate_pool_count": 5,
        "selected_count": 1
      },
      "name": "discovery",
      "started_at": "2026-08-22T12:55:46.538813Z",
      "status": "passed"
    },
    {
      "duration_ms": 140283,
      "error_code": "production_failed",
      "error_summary": "Production did not publish the selected paper: entailment_unsupported",
      "metrics": {},
      "name": "production",
      "started_at": "2026-08-22T12:55:46.581967Z",
      "status": "failed"
    },
    {
      "duration_ms": 0,
      "error_code": null,
      "error_summary": null,
      "metrics": {},
      "name": "bundle_verify",
      "started_at": "2026-08-22T12:58:06.865444Z",
      "status": "skipped"
    },
    {
      "duration_ms": 0,
      "error_code": null,
      "error_summary": null,
      "metrics": {},
      "name": "retrieval_verify",
      "started_at": "2026-08-22T12:58:06.865457Z",
      "status": "skipped"
    },
    {
      "duration_ms": 0,
      "error_code": null,
      "error_summary": null,
      "metrics": {},
      "name": "api_chat_verify",
      "started_at": "2026-08-22T12:58:06.865462Z",
      "status": "skipped"
    },
    {
      "duration_ms": 0,
      "error_code": null,
      "error_summary": null,
      "metrics": {},
      "name": "receipt",
      "started_at": "2026-08-22T12:58:06.865467Z",
      "status": "passed"
    }
  ],
  "started_at": "2026-08-22T12:55:39.007155Z",
  "topic": "LLM agent memory"
}
