{
  "answer_length": null,
  "answer_sha256": null,
  "browser_status": "skipped",
  "browser_summary": null,
  "bundle_markdown_path": null,
  "chunk_ids": [],
  "citation_ids": [],
  "claim_ids": [],
  "content_sha256": null,
  "domain": "llm_agent_memory",
  "evidence_level": null,
  "final_status": "acceptance_failed",
  "knowledge_id": null,
  "knowledge_version": null,
  "manifest_status": null,
  "model": "deepseek-v4-flash",
  "provenance_sha256": null,
  "receipt_schema_version": 1,
  "run_id": "real-paper-04fd13be-13b0-4779-bee2-a8b9ea9ab010",
  "run_kind": "real",
  "source_anchor_ids": [],
  "source_id": "2608.04746v1",
  "stages": [
    {
      "duration_ms": 6208,
      "error_code": null,
      "error_summary": null,
      "metrics": {
        "check_count": 5
      },
      "name": "preflight",
      "started_at": "2026-08-22T08:58:24.304669Z",
      "status": "passed"
    },
    {
      "duration_ms": 34,
      "error_code": null,
      "error_summary": null,
      "metrics": {
        "candidate_pool_count": 5,
        "selected_count": 1
      },
      "name": "discovery",
      "started_at": "2026-08-22T08:58:30.513013Z",
      "status": "passed"
    },
    {
      "duration_ms": 8960,
      "error_code": "production_failed",
      "error_summary": "Raw paper material persisted in managed roots: root-1/transient/run-6a704e43-d815-4187-b183-8b90b0475ccf/source.pdf",
      "metrics": {},
      "name": "production",
      "started_at": "2026-08-22T08:58:30.546604Z",
      "status": "failed"
    },
    {
      "duration_ms": 0,
      "error_code": null,
      "error_summary": null,
      "metrics": {},
      "name": "bundle_verify",
      "started_at": "2026-08-22T08:58:39.507105Z",
      "status": "skipped"
    },
    {
      "duration_ms": 0,
      "error_code": null,
      "error_summary": null,
      "metrics": {},
      "name": "retrieval_verify",
      "started_at": "2026-08-22T08:58:39.507120Z",
      "status": "skipped"
    },
    {
      "duration_ms": 0,
      "error_code": null,
      "error_summary": null,
      "metrics": {},
      "name": "api_chat_verify",
      "started_at": "2026-08-22T08:58:39.507126Z",
      "status": "skipped"
    },
    {
      "duration_ms": 0,
      "error_code": null,
      "error_summary": null,
      "metrics": {},
      "name": "receipt",
      "started_at": "2026-08-22T08:58:39.507131Z",
      "status": "passed"
    }
  ],
  "started_at": "2026-08-22T08:58:24.300834Z",
  "topic": "LLM agent memory"
}
