{
  "answer_length": null,
  "answer_sha256": null,
  "browser_status": "skipped",
  "browser_summary": null,
  "bundle_markdown_path": "papers/2608.16447v1/2026-08-22T10-24-19.839687-00-00.md",
  "chunk_ids": [
    "chunk:4c8e98548b3a6a92c815dbd9",
    "chunk:e2573e06650f7c51d1f03edf",
    "chunk:f9f2346f534f7f26de9785d8"
  ],
  "citation_ids": [],
  "claim_ids": [
    "claim:1",
    "claim:2",
    "claim:3"
  ],
  "content_sha256": "17ba2d0323965ec0775df31b3876dfd141708b80162bd9afa7164dcbeabf4928",
  "domain": "llm_agent_memory",
  "evidence_level": "full_text_text",
  "final_status": "acceptance_failed",
  "knowledge_id": "kp:arxiv:2608.16447v1",
  "knowledge_version": "2026-08-22T10:24:19.839687+00:00",
  "manifest_status": "indexed",
  "model": "deepseek-chat",
  "provenance_sha256": "d6cf44922d4f30e9b92c0e02a5689215a590debacd08bbaf87224f525930d2ec",
  "receipt_schema_version": 1,
  "run_id": "real-paper-6b42d2fe-93a2-4e63-90fb-653ea4c018ac",
  "run_kind": "real",
  "source_anchor_ids": [
    "source:2608.16447v1:harecap-habitual-action-grounding-for-recursive-large-language-model-agents:2",
    "source:2608.16447v1:4-1-experimental-setup:19",
    "source:2608.16447v1:3-3-runtime-retrieval-and-triggering:15"
  ],
  "source_id": "2608.16447v1",
  "stages": [
    {
      "duration_ms": 7798,
      "error_code": null,
      "error_summary": null,
      "metrics": {
        "check_count": 5
      },
      "name": "preflight",
      "started_at": "2026-08-22T10:23:07.267548Z",
      "status": "passed"
    },
    {
      "duration_ms": 24,
      "error_code": null,
      "error_summary": null,
      "metrics": {
        "candidate_pool_count": 1,
        "selected_count": 1
      },
      "name": "discovery",
      "started_at": "2026-08-22T10:23:15.065636Z",
      "status": "passed"
    },
    {
      "duration_ms": 68906,
      "error_code": null,
      "error_summary": null,
      "metrics": {
        "published_count": 1
      },
      "name": "production",
      "started_at": "2026-08-22T10:23:15.089604Z",
      "status": "passed"
    },
    {
      "duration_ms": 6,
      "error_code": null,
      "error_summary": null,
      "metrics": {
        "source_anchor_count": 3,
        "source_fact_count": 3
      },
      "name": "bundle_verify",
      "started_at": "2026-08-22T10:24:23.995967Z",
      "status": "passed"
    },
    {
      "duration_ms": 145,
      "error_code": null,
      "error_summary": null,
      "metrics": {
        "chunk_count": 3
      },
      "name": "retrieval_verify",
      "started_at": "2026-08-22T10:24:24.001779Z",
      "status": "passed"
    },
    {
      "duration_ms": 135,
      "error_code": "scoped_answer_insufficient",
      "error_summary": "Scoped chat reported insufficient evidence or requested supplementation.",
      "metrics": {},
      "name": "api_chat_verify",
      "started_at": "2026-08-22T10:24:24.146785Z",
      "status": "failed"
    },
    {
      "duration_ms": 0,
      "error_code": null,
      "error_summary": null,
      "metrics": {},
      "name": "receipt",
      "started_at": "2026-08-22T10:24:24.282050Z",
      "status": "passed"
    }
  ],
  "started_at": "2026-08-22T10:23:07.263001Z",
  "topic": "habitual action grounding"
}
