{
  "answer_length": 1422,
  "answer_sha256": "b970652cd30d63a3aa8c799d3b53233e205893851c457e39ef4e5e46ab7f7b08",
  "browser_status": "passed",
  "browser_summary": "真实 React 页面显示同一 knowledge ID、当前 Markdown、来源链接和 scoped grounded answer；引用均属于当前版本，未见浏览器 console error。",
  "bundle_markdown_path": "papers/2608.18351v1/2026-08-22T10-37-31.084511-00-00.md",
  "chunk_ids": [
    "chunk:7df3fb00f55debe3340ae6fa",
    "chunk:a7ca549d36718cf27573b54b",
    "chunk:c65dbf955aa311127195502e",
    "chunk:cbb91f9795f3c436c62e4ce8"
  ],
  "citation_ids": [
    "kp:arxiv:2608.18351v1@2026-08-22T10:37:31.084511+00:00|anchor:kp:arxiv:2608.18351v1:2026-08-22T10:37:31.084511+00:00:claim-1:1|claim:1",
    "kp:arxiv:2608.18351v1@2026-08-22T10:37:31.084511+00:00|anchor:kp:arxiv:2608.18351v1:2026-08-22T10:37:31.084511+00:00:claim-2:2|claim:2",
    "kp:arxiv:2608.18351v1@2026-08-22T10:37:31.084511+00:00|anchor:kp:arxiv:2608.18351v1:2026-08-22T10:37:31.084511+00:00:claim-3:3|claim:3",
    "kp:arxiv:2608.18351v1@2026-08-22T10:37:31.084511+00:00|anchor:kp:arxiv:2608.18351v1:2026-08-22T10:37:31.084511+00:00:claim-4:4|claim:4",
    "kp:arxiv:2608.18351v1@2026-08-22T10:37:31.084511+00:00|anchor:kp:arxiv:2608.18351v1:2026-08-22T10:37:31.084511+00:00:claim-5:5|claim:5"
  ],
  "claim_ids": [
    "claim:1",
    "claim:2",
    "claim:3",
    "claim:4"
  ],
  "content_sha256": "1b93918d18d4a119f3c9bac9cd479031105f6cefa9a7fa20da5e7d3d192295be",
  "domain": "llm_agent_memory",
  "evidence_level": "full_text_text",
  "final_status": "passed",
  "knowledge_id": "kp:arxiv:2608.18351v1",
  "knowledge_version": "2026-08-22T10:37:31.084511+00:00",
  "manifest_status": "indexed",
  "model": "deepseek-chat",
  "provenance_sha256": "6f7ca492be14ebfc34228208608c12b732f3e63c74ccc7b51894090b4db73f09",
  "receipt_schema_version": 1,
  "run_id": "real-paper-d77ab144-7a30-43dd-9362-eb7f6902d2ee",
  "run_kind": "real",
  "source_anchor_ids": [
    "source:2608.18351v1:task-conditioned-least-privilege-learning-for-executable-terminal-and-mcp-agents:1",
    "source:2608.18351v1:i-introduction:4",
    "source:2608.18351v1:d-reward-and-training:14",
    "source:2608.18351v1:e-continuation-study-results:27"
  ],
  "source_id": "2608.18351v1",
  "stages": [
    {
      "duration_ms": 7325,
      "error_code": null,
      "error_summary": null,
      "metrics": {
        "check_count": 5
      },
      "name": "preflight",
      "started_at": "2026-08-22T10:36:20.833614Z",
      "status": "passed"
    },
    {
      "duration_ms": 60,
      "error_code": null,
      "error_summary": null,
      "metrics": {
        "candidate_pool_count": 5,
        "selected_count": 1
      },
      "name": "discovery",
      "started_at": "2026-08-22T10:36:28.158540Z",
      "status": "passed"
    },
    {
      "duration_ms": 66062,
      "error_code": null,
      "error_summary": null,
      "metrics": {
        "published_count": 1
      },
      "name": "production",
      "started_at": "2026-08-22T10:36:28.218959Z",
      "status": "passed"
    },
    {
      "duration_ms": 8,
      "error_code": null,
      "error_summary": null,
      "metrics": {
        "source_anchor_count": 4,
        "source_fact_count": 4
      },
      "name": "bundle_verify",
      "started_at": "2026-08-22T10:37:34.280500Z",
      "status": "passed"
    },
    {
      "duration_ms": 310,
      "error_code": null,
      "error_summary": null,
      "metrics": {
        "chunk_count": 4
      },
      "name": "retrieval_verify",
      "started_at": "2026-08-22T10:37:34.288382Z",
      "status": "passed"
    },
    {
      "duration_ms": 6009,
      "error_code": null,
      "error_summary": null,
      "metrics": {
        "citation_count": 5,
        "question_count": 1
      },
      "name": "api_chat_verify",
      "started_at": "2026-08-22T10:37:34.598678Z",
      "status": "passed"
    },
    {
      "duration_ms": 0,
      "error_code": null,
      "error_summary": null,
      "metrics": {},
      "name": "receipt",
      "started_at": "2026-08-22T10:37:40.608138Z",
      "status": "passed"
    }
  ],
  "started_at": "2026-08-22T10:36:20.826489Z",
  "topic": "large language model agents"
}
