{
  "answer_length": null,
  "answer_sha256": null,
  "browser_status": "skipped",
  "browser_summary": null,
  "bundle_markdown_path": "papers/2608.19854v1/2026-08-22T10-30-57.970793-00-00.md",
  "chunk_ids": [],
  "citation_ids": [],
  "claim_ids": [
    "claim:1",
    "claim:2",
    "claim:3",
    "claim:4"
  ],
  "content_sha256": "d54d960f90738adcb7ba7cce7dfb7f47fbc4528396a85e9d3f6df1280217060f",
  "domain": "llm_agent_memory",
  "evidence_level": "full_text_text",
  "final_status": "acceptance_failed",
  "knowledge_id": "kp:arxiv:2608.19854v1",
  "knowledge_version": "2026-08-22T10:30:57.970793+00:00",
  "manifest_status": "indexed",
  "model": "deepseek-chat",
  "provenance_sha256": "c14ab3fc1c2c2db17f20972e4f779d8b4dc7b3ef25340043cc496b4ae89f5a75",
  "receipt_schema_version": 1,
  "run_id": "real-paper-0ba31383-2cd9-48af-b51d-67562377cc36",
  "run_kind": "real",
  "source_anchor_ids": [
    "source:2608.19854v1:repo0-design-driven-zero-to-all-code-generation:1",
    "source:2608.19854v1:c-phase-ii-modularity-guided-structural-evolution-loop:14",
    "source:2608.19854v1:b-rq2-ablation-study:29"
  ],
  "source_id": "2608.19854v1",
  "stages": [
    {
      "duration_ms": 6786,
      "error_code": null,
      "error_summary": null,
      "metrics": {
        "check_count": 5
      },
      "name": "preflight",
      "started_at": "2026-08-22T10:29:16.547265Z",
      "status": "passed"
    },
    {
      "duration_ms": 22,
      "error_code": null,
      "error_summary": null,
      "metrics": {
        "candidate_pool_count": 5,
        "selected_count": 1
      },
      "name": "discovery",
      "started_at": "2026-08-22T10:29:23.333085Z",
      "status": "passed"
    },
    {
      "duration_ms": 98982,
      "error_code": null,
      "error_summary": null,
      "metrics": {
        "published_count": 1
      },
      "name": "production",
      "started_at": "2026-08-22T10:29:23.355375Z",
      "status": "passed"
    },
    {
      "duration_ms": 7,
      "error_code": null,
      "error_summary": null,
      "metrics": {
        "source_anchor_count": 3,
        "source_fact_count": 4
      },
      "name": "bundle_verify",
      "started_at": "2026-08-22T10:31:02.337121Z",
      "status": "passed"
    },
    {
      "duration_ms": 163,
      "error_code": "retrieval_invalid",
      "error_summary": "FTS returned an ungrounded or non-fact chunk.",
      "metrics": {},
      "name": "retrieval_verify",
      "started_at": "2026-08-22T10:31:02.344176Z",
      "status": "failed"
    },
    {
      "duration_ms": 0,
      "error_code": null,
      "error_summary": null,
      "metrics": {},
      "name": "api_chat_verify",
      "started_at": "2026-08-22T10:31:02.507588Z",
      "status": "skipped"
    },
    {
      "duration_ms": 0,
      "error_code": null,
      "error_summary": null,
      "metrics": {},
      "name": "receipt",
      "started_at": "2026-08-22T10:31:02.507605Z",
      "status": "passed"
    }
  ],
  "started_at": "2026-08-22T10:29:16.541219Z",
  "topic": "large language model agents"
}
